country,ratingScore,reviewDescription,reviewTitle,Model,Core
Canada,5,"This is a great cpu, period.*HOWEVER* get a thermalright contact plate to replace your mobo's socket clamp. This is a must have item to keep your cpu flat to make proper contact with your cooler. It's a 20 dollar part, installs in seconds and can lower your temps 10c easy.Thank me later!",Powerful cpu,i7 13th Gen,i7
Mexico,5,Excelente,Funciona como debe 🫨,i7 13th Gen,i7
United States,5,"Overlocking the crap out of this with liquid cooling. Rock solid - not a blue screen in site. Dedicate 8 cores to a VM with no appreciable decline in bare metal OS operation. Temps are higher with the same cooler as compared to 12700k (12700k running 30-40C under load, this jumps to the 50-60C area pretty quick.",Just destroys whatever I throw at it,i7 13th Gen,i7
United States,5,A very good midrange processor. I've use one for years and it has always worked well for me.,A great processor,i7 13th Gen,i7
United States,5,I got this CPU to upgrade from my 11th gen i7-11700KF Processor. Temps are a slight bit toasty compared to my 11th gen CPU but pairs real well with my 4070 ti.,The Best CPU Upgrade Ever,i7 13th Gen,i7
United States,5,"I use this i7-13700K every day for about a year. I have Crucial RAM 64GB Kit (2x32GB) DDR5 4800MT/s CL40 Desktop Memory CT2K32G48C40U5 modules (4 of them), a Corsair RM1000x (2021) Fully Modular ATX Power Supply in a Phanteks Enthoo Pro Full Tower Chassis without Window Cases PH-ES614PC_BK in service for about one year as I write this review. For the most part, assembly was very easy. I do video editing, audio editing, streaming, wordprocessing, browsing and email with my setup. I use all of my SATA ports and even have a plug-in eSATA card for more ports. So most of my drive bays are filled. The cpu, dram and everything I have connected to my power supply and motherboard has been rock solid stable, and the case holds in all together. It just works exactly the way I want and have no anomalies. The power supply, motherboard and all components run cool in the case with an i7-13700K CPU, 128 GB of Crucial DDR5-4800 that is clocked at 5200 automatically set by the motherboard itself. My video card is a the very modest ASUS GeForce GT 1030 2GB GDDR5 HDMI DVI Graphics Card (GT1030-2G-CSM) because I transitioned my ancient setup from MBR to GPT and needed to be able to boot the old system in the new motherboard before updating the Windows 10 Pro config to GPT UEFI and still be able to boot legacy devices. Everything just worked like a Swiss Chronograph. I strongly recommend this cpu, dram, the power supply, the case, the ASUS ProArt Z790-Creator WiFi 6E LGA 1700, the Asus video card, and am also recommending the Crucial MX500 SATA drives I use. Is it all of this the fastest? I have no idea. Does it boot and work reliably everytime so far? Absolutely!",Stable System,i7 13th Gen,i7
United States,5,I’m very happy with this processor.,Great processor,i7 13th Gen,i7
United States,5,Just what I needed.  It is fast and it's not annoying. Used it for a small rig.,CPU,i7 13th Gen,i7
United States,5,"Replacement from the core i5-12700kf; booted right away, all cores shown & while undercooked works perfectly! Baby in the background couldn't believe it. Thank you Amazon for coming through once again with a formidable solution. Paid the extra $100 to make sure the problem of the i5 did not continue to occur. Problem solved!",Replacement from Intel CORE i5-12700kf; problem solved!,i7 13th Gen,i7
United States,5,"Nice!  I upgraded from an AMD Ryzen 7 5800X to this CPU (and the components below) and I couldn't be happier.  Everything opens almost instantly, whether it be Windows 11's File Explorer, Edge browser and webpages, and opening files in general.  I upgraded primarily because I am a developer, and Visual Studio + Dotfuscator would take almost 8 minutes to compile and obfuscate my largest program on my old build.  After upgrading, it now compiles in about 4 mins 45 seconds.  The longest part is Dotfuscator, not Visual Studio compiling.  Compiling happens in seconds on this setup.My components:MSI MPG Z790 Carbon WiFi Gaming MotherboardIntel Core i7-13700K Desktop Processor(this CPU)CORSAIR VENGEANCE DDR5 RAM 64GB (2x32GB) 5600MHzMSI MPG A1000G PCIE 5 & ATX 3.0 Gaming Power Supply - Full Modular - 80 Plus Gold Certified 1000WCorsair MP700 2TB PCIe Gen5 x4 NVMe 2.0 M.2 SSDCooler Master Hyper 212 Halo White CPU Air CoolerMSI Gaming GeForce RTX 3060 Ti Graphics CardI don't game much, but there is a noticeable difference loading and playing Cities: Skylines after upgrading, too.I am very happy with the new PC.  Everything runs smoothly, I haven't had a single crash running the XMP Profile in BIOS for my RAM so it runs at full speeds.  This CPU blows the Ryzen 7 5800X out of the water.  Check out the UserBenchmark: AMD Ryzen 7 5800X vs Intel Core i7-13700K comparison on UserBenchmark's website for details, which is what I did before purchase.  It lives up to the benchmarks for me.","Huge upgrade from Ryzen 5800X, cut my Visual Studio/Dotfuscator compile times significantly",i7 13th Gen,i7
United States,5,Spend the money once and get a good processor you wont regret!,Wonderful processor!,i7 13th Gen,i7
United States,5,without a doubt good CPU stays cool over clocked at 35 c runs good worth the money.,Nice,i7 13th Gen,i7
United States,5,"I was close to give them a bad review but then I found out USPS was the problem with my delivery.  If possible, find another shipping method to avoid delays.  Product exactly as described, much needed! Now I can finish building my pc. Thank you",As described,i7 13th Gen,i7
United States,5,"Paired with my 3060ti founders edition, I have yet to run a game that seems like this combo couldn’t handle. Apart from gaming it can handle multiple instances of tasks and run them all seamlessly. This is the most powerful CPU I’ve had but it still impresses me how fast everything is and I have not seen its limits yet.",Powerful / cost effective CPU,i7 13th Gen,i7
United States,5,"Nothing to say, all is okay",Super,i7 13th Gen,i7
United States,5,"I built a new computer during the height of covid (Dummy, I know, right?) and decided on a i9-9900k. I'm a sysadmin by trade, so remoting in and fixing servers has never been an issue with that processor..but for gaming..Titles like Cyberpunk, Days Gone, to even WoW..there were areas that my 3080 was being bottlenecked by the 9900k.I coupled this CPU with a MSI EDGE z790 DDR4 (I have fantastic Samsung B-Die CL14 3600 DDR4 from the previous build). So far, in Cyberpunk I'm seeing 25-30 more FPS on 1440p Ultra settings w/ Raytraycing on High. WoW is getting 50+ more FPS, and I'm getting over 100 FPS in Valdrakken, where I was getting 45-50 FPS with the 9900k with the same settings as cyberpunk (1440p ultra (10 graphics settings).I'm using the Corsair iCUE H100i Elite LCD 240mm AIO, with Thermal Grizzly Kryonaut Extreme thermal paste to cool this bad boy, and even at prolonged sessions in Cyberpunk, my temps are not getting above 65c. And no, I have not done the Contact Plate mod.TL;DR - This CPU is blazing fast, and if your current processor is a few years old it may very well be worth the upgrade. I don't claim to be Steve from Gamers Nexus, or a pro CPU tester - but I can tell you that this thing is amazing, and will serve you well for years to come.",Who needs an i9! This thing is amazing!,i7 13th Gen,i7
United States,5,"I love this chip, fast and efficient also stays cool with my 280MM AIO.  I had to replace my MB and Intel i7 8th gen 8700K so got this over the i9 and could not be happier.  Wish Intel would drop their prices but it is a value for what you get",Fantastic CPU & Fast,i7 13th Gen,i7
United States,5,its great. just buy it. or the 14700k.,Its top tier,i7 13th Gen,i7
United States,5,Great value for my gaming PC :D,great CPU,i7 13th Gen,i7
United States,5,"I had a 6 year old Acer TC-780 desk top with an i7-7700 cpu. Due to not able to upgrade to windows 11 and microsoft scheduled to stop supporting windows 10 October 2024.  I gave myself a year to shop for a new PC Knowing Black Friday/Cyber Monday have the best prices and deals.  I like the Gaming RGB astatic and after months of researching online I decided I was going to Build my next PC.  Black Friday came early this year Thanks to Prime Day, and  MSI Mag Z790 Tomahawk MB,  and V- color DDR5 Oc 7200mhz 32g RAM, and MSI RTX4070 GPU And the Intel i7-13700K  all powered from a Gamemax 1050W PSU,  I have a Brand new POWERFUL Gaming PC That will serve me well in the years to come.",Feel the power,i7 13th Gen,i7
United States,5,I wanted speed without breaking the bank and this CPU fits the bill. Runs a little hot but not too much to handle with an AIO water cooler (I use a Deepcool LT520). Pleased with my build.,Very good CPU,i7 13th Gen,i7
United States,5,"Running in XMP mode, all cores synced, with ram clocked at 7200mhz! No problems whatsoever. Runs fast and cool compared to my old 5930k.",Chews through everything without breaking a sweat,i7 13th Gen,i7
United States,5,"The i7-13700K has i7-12900K performance at an i7 range price range. Please note I used an older Z690 EVGA Classified Board. I was required to flash because older boards cannot support the new CPU yet. I suggest people who used a 12th gen chipset and were looking to upgrade follow their respective motherboard’s vendor manual. The installation was incredibly easy, and I booted the BIOS after the BIOS update without any problem. I had hit 5 GHz on the CPU without overclocking. It also supported 6000 MHz DDR5 RAM without any issues after enabling XMP. The reasonable pricing for Z690 or Z790 boards makes the i7-13700K a good combo compared to AMD’s expensive Ryzen 7000 CPUs and motherboard costs. For people who are still on older generations, the vast E cores and P cores offered by Intel’s 13th gen make it worth it to accomplish CPU-intensive tasks like Handbrake or Adobe Premiere. This CPU runs cool with a 360 mm AIO and a high airflow case (around 30-36 C idle temperature for me). I also like to note the CPU fits only fits one way and the CPU lever has a bit of tension, so don’t be afraid when installing your CPU.",Fantastic Performance/Value Workstation CPU,i7 13th Gen,i7
United States,5,Open box/used good condition item. Purchased for my Wife's latest build... Wound up having a better memory controller than my old 13900KS ... runs reeeeally cool.,Silicon lottery winner,i7 13th Gen,i7
United States,5,"The i7 runs a bit hotter than the 13th gen i5, but I just couldn't resist spending a bit more for those extra cores. As of 2023, it's a razor-fast CPU for the average buyer - probably too powerful for anyone but power-users and video-editors. As for gaming, it'll run many older games at a high FPS even without any help from a GPU, and it handles modern titles without any problems, too.It CAN run with a low-power or stock-quality cooler for daily tasks, but I'd recommend investing in water cooling if you plan to throw heavy-duty loads at it, or good-performance air cooling if you're planning to buy it once and keep running it many years into the future.",Very Fast in 2023,i7 13th Gen,i7
Canada,5,"This is my first upgrade since the i7-4790k, this processor is a BEAST! Eats away at any task i throw at it without a sweat! I was a little hesitant with the new cpu designs with the Performance and efficiency cores but man, the efficiency cores alone kill my 4790k! 👌🏻 great cpu, just make sure you know these shoot to the sky heat wise when you punch heavy workloads and you will need cooling to match depending of how long and how much you will need to pull away from it. 👍🏻",Trust in Intel i have!,i7 13th Gen,i7
United States,5,"Purchased on sale for $334. The 13700k is the best value CPU if you require enough speed for high-end gaming + productivity (e.g. video editing/rendering, streaming, multitasking, etc). This thing is fast. I was able to undervolt it and overlock it to 5.5 Ghz (all p-core) and 4.4 Ghz (all e-cores). I could go higher if I wanted to spend more time on it, but this was a quick overclock. Perfectly stable and runs (relatively)cool with the undervolt. Intel is still my preference for CPUs and I don't foresee that changing, especially with all of the issues I've read regarding AMD chips (boot up issues, crashes, poor multi-core performance).",The quality you expect from Intel,i7 13th Gen,i7
United States,5,"My previous build had an i7-9700K and after 5 years of abuse, I decided to upgrade in this new build to an i7-13700K and I'm not disappointed.  It's a great CPU and is handling everything I throw at it.  Stays cool even without a fancy AIO / liquid cooling setup.  During the process of installing the CPU on the socket, it fell into place perfectly, but when adjusting the motherboard arm to secure the CPU into the socket, it did feel I had to put a bit more force than I would have thought necessary, but it clicked into place and is running smoothly with no issues.  Highly recommended!=====Complete Parts List=====MSI MAG Z790 Tomahawk WiFi LGA 1700 ATX Motherboard -https://www.newegg.com/p/N82E16813144567?item=N82E16813144567Cable Matters 2-Pack 3 way 4 pin PWM Fan Splitter -https://www.amazon.com/dp/B07PXLHNZ6?psc=1&ref=ppx_yo2ov_dt_b_product_detailsArctic MX-4 Thermal Paste -https://www.amazon.com/dp/B0795DP124?psc=1&ref=ppx_yo2ov_dt_b_product_detailsCableMod C-Series Classic ModMesh Sleeved Cable Kit -https://www.amazon.com/dp/B07HMJ6GNJ?psc=1&ref=ppx_yo2ov_dt_b_product_details(2x) Corsair Vengeance DDR5 RAM 5600MHz CL36 -https://www.amazon.com/dp/B09WH64X5M?psc=1&ref=ppx_yo2ov_dt_b_product_detailsASUS Dual GeForce RTX 4070 White OC 12GB DDR6X -https://www.amazon.com/dp/B0C4BZZWJM?psc=1&ref=ppx_yo2ov_dt_b_product_detailsNZXT H9 Flow Dual-Chamber Mid-Tower -https://www.amazon.com/dp/B0BG1GQKKY?psc=1&ref=ppx_yo2ov_dt_b_product_details(2x) Corsair LL120 RGB Triple Pack -https://www.amazon.com/dp/B07LF1B1Y8?psc=1&ref=ppx_yo2ov_dt_b_product_detailsIntel i7-13700K 16core -https://www.amazon.com/dp/B0BCF57FL5?psc=1&ref=ppx_yo2ov_dt_b_product_detailsCorsair RM850x Full Modular ATX PSU -https://www.amazon.com/dp/B08R5JPTMZ?psc=1&ref=ppx_yo2ov_dt_b_product_detailsRocketek 9pin USB Header Splitter -https://www.amazon.com/dp/B085KVH16T?psc=1&ref=ppx_yo2ov_dt_b_product_detailsDeepCool AK400 CPU Cooler -https://www.amazon.com/dp/B09PCWK7SP?psc=1&ref=ppx_yo2ov_dt_b_product_detailsSamsung 970 Evo Plus 1TB NVMe M.2 SSD -https://www.amazon.com/dp/B07MFZY2F2?psc=1&ref=ppx_yo2ov_dt_b_product_details",Great CPU - can't go wrong!,i7 13th Gen,i7
Canada,5,"What can you say about this processor that hasn't already been said. Just know you need a good cooler on it, because it does get HOT! Performance is great and with Intel's XTU app it is easy to overclock and achieve even more.",It runs HOT!,i7 13th Gen,i7
United States,5,I am a team blue guy. And I think this is a great cpu for the money. Currently running at 5200 and very stable.,Good CPU,i7 13th Gen,i7
United States,5,"Extremely powerful for the money, handled AAA games with ease. Would recommend for anyone’s PC build.",Awesome CPU,i7 13th Gen,i7
United States,5,"Really powerful cpu for sure, haven't even been able to find a game that limits it out, thermals are beautiful with the h150i elite under heavy loads staying in the 50s-60s. Perfect for 1080p-1440p and even could potentially run some 4k games with the right gpu paired. Overall very happy with the performance!",Absolute unit for 1080p-1440p gaming,i7 13th Gen,i7
United States,5,"Great workstation CPU. Upgraded my aging Intel Haswell 4770k workstation to these new, e-core embedded Intel CPUs.Only negative drawback is that these newer Intel CPUs run hot and eat quite a bit of wattage.Should have picked an I5 instead but wanted to future proof my new workstation until 2030.Highly recommend!",Great workstation CPU,i7 13th Gen,i7
United States,5,Except the i9! Beautifully powerful processor. Very happy with it.,Can’t be beat!,i7 13th Gen,i7
United States,5,"I previously built an 8th gen i7 for gaming and work, relegating my 1st gen i7 to my hobby (ham radio)  after 13 years that mobo started acting up, and I made the decision to build a new computer for gaming and put the 8th gen to my hobby.The 13700K with the durable motherboard I chose is awesome.  It handles the fastest NVMe drives, fastest memory and keeps up with my extremely high end video card.  I really cannot speak highly enough.  I had considered a different brand, and the 12th gen i7, but after two months with the 13700K I can honestly say I could not be happier.Thank you Intel.",Awesome processor,i7 13th Gen,i7
United States,5,"Bought it for $373 on Prime Day, two days later it dropped to $364.99 (14700k came out). That's the only complain I could have.",Works Like a Champ !,i7 13th Gen,i7
Japan,5,"Playing valorant with competitive settings, average 99% fps is 400+",Very powerful,i7 13th Gen,i7
Canada,5,Has really improved my gaming and streaming services along faster and better than my 7th gen i7,Improved preformance,i7 13th Gen,i7
United States,5,"Intel Core i7-13700K: Gaming Beast with Brawn and Bandwidth, But Not Without BiteOverall Rating: 4.5 out of 5 starsFor: Serious gamers, demanding content creators, overclocking enthusiasts, those upgrading from older systemsAgainst: Pricey compared to previous generations, runs hot, requires beefy coolingPerformance: 5 out of 5 starsThe i7-13700K packs a serious punch. Its hybrid architecture with 8 performance cores and 8 efficient cores tackles demanding tasks with ease. Whether you're pushing pixels in the latest AAA titles or crunching numbers in complex spreadsheets, this CPU thrives under pressure. In gaming, expect silky-smooth frames at 1440p and beyond, even in the most demanding titles. Compared to its predecessor, the i7-12700K, it offers a noticeable performance boost, especially in multi-threaded workloads.Overclocking: 4.5 out of 5 starsThe i7-13700K is an overclocker's dream. It offers plenty of headroom for pushing clock speeds, unlocking even more performance potential. However, remember that this comes at the cost of increased power consumption and heat generation. Ensure you have a robust cooling solution like a high-end air cooler or AIO liquid cooler to keep things under control.Features: 4 out of 5 starsThe i7-13700K boasts impressive specs: PCIe 5.0 support for next-gen hardware, DDR5 memory compatibility, and Intel UHD Graphics 770 for basic graphics needs. This future-proofs your build and ensures you're ready for the latest tech as it emerges. However, keep in mind that the cost of DDR5 memory might still be a drawback for some.Value: 4 out of 5 starsWhile the i7-13700K delivers fantastic performance, it comes at a premium price tag. Compared to previous generations, the cost per core has increased. However, it still offers compelling value compared to its closest competitor, the AMD Ryzen 7 7700X, especially for gaming. Remember, you'll need to factor in the cost of a capable cooler and potentially DDR5 memory, further impacting the overall value proposition.Things to Consider:Heat and Power Consumption: This CPU runs hot, especially under overclocking. Invest in a robust cooling solution to avoid thermal throttling.Price: The i7-13700K is expensive compared to older generations and slightly pricier than its main competitor. Consider your budget carefully.DDR5 Compatibility: While future-proof, DDR5 memory is still more expensive than DDR4. Factor this into your overall build cost.Final Verdict:The Intel Core i7-13700K is a top-tier processor for serious gamers, demanding content creators, and overclocking enthusiasts. Its blistering performance, PCIe 5.0 and DDR5 support, and overclocking headroom make it a future-proof powerhouse. However, the high price, heat generation, and DDR5 compatibility requirements might be dealbreakers for some. If you're looking for the ultimate in gaming and multi-core performance and have the budget for a premium build, the i7-13700K is a worthy investment. Just be prepared to feed it some serious watts and keep it cool.Note:This review is based on my own research and comparison of benchmarks. Your results may vary depending on your specific hardware and software configuration",Cant beat this value,i7 13th Gen,i7
