country,ratingScore,reviewDescription,reviewTitle,Model,Core
United States,5,"In general - all mentioned in this review products are as described and working as described. Almost all deserve 5 stars (commented if one or more stars are taken off). Instead of reviewing item by item I decided to write one review for all products used for one specific PC build. The purpose of this PC build - fancy compact gaming system.Items used in this build:--Item 1) OCPC Mini ITX Case, Hydra Italy Mini ITX PC Case, Amazon https://www.amazon.com/gp/product/B0BK6D77DG/Very good case – compact, cool looking and efficient. The black color is the only variant I found on Amazon. With only cooling from top-down CPU cooler, the i7-13700K based system passed the stress test very well. Riser cable is not included – actually the riser cable for GPU orientation as shown on Amazon item photo does not exist. In order to build the system as shown, I bought a flexible riser cable (Item #2) and twisted it to 180°. Another simpler solution is to install GPU upside down as presented by other reviewers on Amazon.--Item 2) EZDIY-FAB PCIE 4.0 16x Extreme High Speed Flexible Riser Cable PCI Express Port GPU Extension Card-Dual Reverse Connector for ITX [21cm]. Amazon https://www.amazon.com/gp/product/B09S5DW3RX/-Does the job - exactly what I need for the project. Note: During system build I have to remove the bracket from the cable male connector and install it back after passing cable through the case hole.--Item 3) Power supply: Cooler Master V750 SFX Gold Full Modular, 750W, Amazon https://www.amazon.com/gp/product/B08LP7B7FM/- Works as supposed to. PSU had a noticeable burning smell for about 5 days, considering this is normal for a new PSU. If you want to build more powerful gaming system, I recommend the PCIe 5.0 ready 850W SFX PSU, something like ARESGAME GL850 https://www.amazon.com/gp/product/B0CHDS4J33/SFX-L PSU will work in Hydra Mini as well, but cable management will be tougher.--Item 4) CPU: Intel Core i7-13700K, Amazon https://www.amazon.com/gp/product/B0BCF57FL5/- Good CPU, working well in gaming.--Item 5) Motherboard: ASUS ROG Strix B760-I Gaming WiFi, Amazon https://www.amazon.com/gp/product/B0BR8TVLPL/- Working as described, nice looking MB. Thank you, ASUS - now ROG motherboards have the Memtest86+ built in BIOS. This very helpful feature allows PC builders to check memory before operating system installation and prevent blue screens and failures during OS install and system use in case of defective memory.In my case originally ordered CORSAIR DOMINATOR PLATINUM RGB DDR5 RAM 64GB (2x32GB) 6400MHz (Amazon https://www.amazon.com/gp/product/B0C1R95SPW/) was defective. Both memory modules came to life and showed ok in BIOS but Memtest86+ got errors. I did test modules one by one in the same memory slot and found out that one of the modules is the cause of the failures. Returned the defective memory and bought another from a different brand (Item #6). ASUS ROG Motherboard chosen for the look. In my opinion the best Intel (or may be overall) mini ITX MB on the market is MSI MPG Z790I Edge WiFi Gaming Motherboard (Amazon https://www.amazon.com/gp/product/B0BHCJ6KQ2/ ) I own one and have a very best experience.--Item 6) Memory: TEAMGROUP T-Force Delta RGB DDR5 Ram 64GB (2x32GB) 6000MHz, Amazon https://www.amazon.com/gp/product/B0BNTV1945/-Very good product, works as described, nice looking, recognized by Aura Sync.--Item 7) Graphics Card: MSI Gaming GeForce RTX 4060 Ti 16GB, Amazon https://www.amazon.com/gp/product/B0CCFZMHSM/- Graphics card work as supposed to, have low power consumption. This GPU was chosen for the look only. Anyway, the presented system can play all modern games well at 1440p. But if you want the very good gaming experience, I will recommend at least RTX 4070 Ti like MSI Gaming GeForce RTX 4070 Ti Ventus 2X 12G OC. And the very best (talking about built on Hydra Italy Mini Case) will be the system with 850W PCIe 5.0 SFX PSU and:a)  MSI MPG Z790I Edge WiFi Gaming Motherboard, Amazon https://www.amazon.com/gp/product/B0BHCJ6KQ2/b) Intel Core i9-13900KF,  https://www.amazon.com/dp/B0BCFM3CJ4/c) ASUS ProArt GeForce RTX™ 4080 16GB OC, ( Amazon https://www.amazon.com/dp/B0C75J66C8/). This compact GPU has included Graphics Card Holder which will work with presented builtI own all of these (a,b,c) components packed in another fancy mini ITX case (Phanteks PH-ES217A_BK02 Evolv Shift 2 Air Mini-ITX case, Fabric Side Panels) and they performed superb in games.--Item 8) SSD Disks:8.1) Primary (system): WD_BLACK 2TB SN850X NVMe Gen4 PCIe M.2 2280 WDS200T2X0E, Amazon https://www.amazon.com/gp/product/B0B7CMZ3QH/8.2) Secondary (backup and media data): Crucial P3 Plus 4TB PCIe Gen4 NVMe M.2 CT4000P3PSSD8, Amazon https://www.amazon.com/gp/product/B0B25M8FXX/- Very good products, works as described, no problems.--Item 9) Antec Power Supply Sleeved Cable, PSU Cables, PSU Extension Cable Kit / 1x24pin ATX / 2x8pin (4+4) EPS / 3X (6+2) pin PCI-E, 30cm Length with Combs, Dual EPS Red Amazon https://www.amazon.com/gp/product/B0BN3H2K17/- Perfect fit for this project, good cables, looks nice.--Item 10)CPU cooler: ID-COOLING IS-67-XT Black 67mm Height Low Profile CPU Cooler, Amazon https://www.amazon.com/gp/product/B0CFPY9CKZ/- Good design, keeps i7-13700K adequately cool in open Air PC Case. Mounting for regular size 120mm fan included. Easy installation - just install radiator 1st and mount fan after. ID-COOLING IS-67-XT chosen because of black color. In my opinion DeepCool AN600 Low Profile CPU Cooler (Amazon https://www.amazon.com/dp/B0C4P8ZPWT/) has a little bit better cooling performance (I have one in a very compact Flex ATX build).--Item 11) EZDIY-FAB Moonlight 120mm RGB PWM Case Fan, Amazon https://www.amazon.com/gp/product/B07X8T79QY/Good, quiet and nice-looking fan. Actually, it is a leftover piece from a 9 fans ATX tower system build. If you want to build a similar system with a similar look, I recommend Cooler Master MF120 Halo² Fan Duo-Ring ARGB (Amazon https://www.amazon.com/gp/product/B0BWKZGYXJ/). This fan has a similar look but has better airflow / air pressure.---Item 12) 24 Pin RGB Cable Extension Kit (used ARGB strip only), Amazon https://www.amazon.com/gp/product/B07WN4G7KC/- The power cable connector to MB too tight - did not go all the way down, afraid to broke the MB if try to apply more force (the regular PSU cable fits perfect). Connector to PSU too tight as well, but was able to connect all the way down. Actually, in reality the system with this cable does not look good (too much RGB). Did use ARGB strip only for decoration purposes on the GPU side.--Item 13) Thermal Paste: ARCTIC MX-6. Optional - I have a very good experience using this thermal paste brand and always using it for the builds (so thermal paste provided by ID-COOLING was not used). Amazon https://www.amazon.com/gp/product/B09VDLH5M6/-----------Overall, I assume the goal is reached - the presented system can play recent games and look very cool (in my humble opinion).","Good CPU, working well in gaming",i7 13th Gen,i7
Canada,5,"No surprises here, the cpu functions exactly as advertised.","No issues, performs as advertised",i7 13th Gen,i7
United States,1,"I've been a lifetime Intel diehard fan but man they really pushed a disappointing product out. This thing gets HOT, I've been building computers for a while but I've never seen a CPU regularly spike to 100 C with liquid cooling. My previous 8700k ran great and was fulling overclocked to 4.8GHz and I never saw anything higher than 78 C under 100% load. I was so sketched out by seeing the 14700k temps that I ran Intel's CPU diagnostic software and I couldn't even finish it! The temps got to a steady 93-100 C while testing so I had to cancel it and let the CPU cool down.I even tried some gaming with it and while playing Helldivers 2 at ""High/Medium"" settings It liked to hover at 95C and spiked constantly. This caused thermal throttling and game stutters followed with it. Even while at the desktop fully idle my temps would spike around from 25 C all the way up to 70 C. The reason for this is the new LGA 1700 socket ILM, you have to buy, replace, and correctly torque a WHOLE new socket brace just so you can kind of tame this CPU.I remember when Intel was known for keeping cool and AMD for getting hot. That's not the case anymore and I'm so disappointed because Intel was my go to with every single PC I ever built.",BEWARE of the New LGA 1700 Socket,i7 14th Gen,i7
United States,5,upgraded from a 12600kf and 3080 10gb and went to this 14700kf and 4070 ti super and its great. added 60-70fps on a lot of games.,came from a 12600k,i7 14th Gen,i7
United States,4,"Wanted to purchase the unlocked version of the 20 core 14th gen processor and saw that this was a cheaper option at the time. All the description says is that ""Discrete graphics is required."" It would be much more helpful by adding a line that says the F version stands for no integrated graphics card. If you're doing any kind of workstation work such as video editing, most software will take advantage of the processor having an iGPU as well and so I'm actually losing performance with this model version. I'll have to return the item to purchase the correct version without an F. I would give it a full 5 stars if it had the line explaining the F version.",Please note that the F in the 14700KF means NO iGPU,i7 14th Gen,i7
United States,5,"A very powerful processor, but if it does not have good cooling, its functions will be limited. Currently it is working wonders together with the other components. But if they have a moderate cooling system, it is advisable to use the other brand of processors ""AMD"" that has half the temperatures, but with 10% to 20% less performance in some activities, and with the defects that come with not have an architecture that self-protects well or do not update its software often for better handling.Finally, I recommend the processor, only if you have a processor that does not meet current needs. My I7 6700k can do it all, but for some specific technologies, such as SSD Gen 4, peripherals with high-speed USB - C and others, it couldn't cope.",High TDP and Temperatures,i7 14th Gen,i7
United States,5,"The i7 14700KF isn't just a CPU; it's a beast unleashed. This 20-core powerhouse purrs like a kitten under normal workloads, staying surprisingly cool thanks to its 7nm architecture. But don't be fooled by its initial demeanor  this CPU is a wolf in sheep's clothing, ready to tear through any demanding games and content creation tasks with ease, I paired with an rx 7900 xtx and forgot about frame rate drops and stuttering.",Great cpu,i7 14th Gen,i7
United States,5,"I bought this as an upgrade from my trusty i9 10900k. I was worried the performance boost would be marginal but I was pleasantly surprised to get a solid boost on 1440p with my rtx 4080 super. Playing Helldivers 2, my fps went from mid 70s-90s to 120-140s at everything maxed out. Playing VR sims like il-2 and DCS has mostly eliminated little stutters and performance drops. Similarly, MSFS 2020 at ultra settings in populated areas provides a smooth and stable experience. My temps generally stay around 65 to 75 underload/demanding gaming. I have seen brief spikes to 80. I'm using an EVGA CLC 280mm cooler. I may need to reapply thermal paste.",Powerful!,i7 14th Gen,i7
United States,1,"While you are installing windows, when you get stuck on finding a network but no networks are listed and it won't let you continue. This is because Windows 11 doesn't support your built in LAN/Wi-Fi drivers.The solution for this is to hitShift+F10 which will bring up the command prompt window. From here you typeOOBE\BYPASSNRO which will re-enable the ""I don't have internet"" option.This will let you continue installing windows.Now you can troubleshoot your network from windows.",Windows install wants a network but no network is listed,i7 14th Gen,i7
United States,1,I received a processor in an Intel I box.No markings on the processor itself. Thermal paste residue still on the processor.  This is crazy!!!,Not sure what CPU I received,i7 14th Gen,i7
United States,1,"Quality/silicon control on 14700k is chaos. What the hell intel thinking and doing I dont know.My 13600KF took 7400mhz ram like champ, while this thing cant get even 6800mhz stable... Very dissapointed.1.35v 300w in cinebench with 100c temps with arctic freezer 280mm (that beats most of 360mm AIOs) + bending corrector and good paste.TRASH.","Trash quality control, trash memory controller",i7 14th Gen,i7
United States,5,"No more lining up pins, now you just make sure this thing sits in the way it belongs and off you go! I've had an H170i on it the whole time but it barely gets into the 40's when under extreme load. For the price, the 14700KF is the way to go imho",So easy to install a baby could do it!,i7 14th Gen,i7
United States,5,"I paired this with a ""GIGABYTE Z790 Eagle AX LGA 1700 Intel Z790 ATX Motherboard with DDR5, M.2, PCIe 5.0, USB 3.2 Gen2X2 Type-C, Intel Wi-Fi 6E, 2.5GbE LAN, Q-Flash Plus, EZ-Latch"" mobo and TGDGAMER ""T-240MM Black ARGB Liquid CPU Water Cooling with 240mm ARGB PWM Fan, Temperature Display, Computer Water Cooling"". The Intel application used AI to tweak my CPU to squeeze out more performance, but under 100% load it will often thermally throttle and sporadically hit 100C. I am considering finding a better cooler to keep up with this racehorse.",Runs HOT - Get a good cooler!,i7 14th Gen,i7
United States,5,"New, great product, came as described and very fast at the same day!",Great product!,i7 14th Gen,i7
United States,5,Works well on my new PC,Highly recommended,i7 14th Gen,i7
United States,5,"Love the processor, got it new and using with a rtx 4090 for 1440p. Have it paired with a z690 formula board and I have the ai optimize the cpu. On a 420 cooler it gets 60c at best with warzone 3 with 240 fps. Fast and consistent,  on a 240 cooler Temps got up to 71-81c keep that in mind. Love my purchase!",Powerful cpu for gaming,i7 14th Gen,i7
United States,5,I really enjoy the speed of this processor. IO would definitely use this again on another build. Didn't rate the gaming because I am not a gamer but I would expect it would be great for that as well.,Super fast,i7 14th Gen,i7
United States,5,It was either this one or the 13th gen. I went with this one for the few extra bucks to stay up to date with things longer. Works great so far with no issues.,"Great so far, one gen newer with no real improvements.",i7 14th Gen,i7
United States,5,I love it.,Thank you.,i7 14th Gen,i7
United States,5,High performance and high heat output. Make sure you have proper cooling for this one!,Performance!,i7 14th Gen,i7
United States,5,"I use this for Gaming and Blender/Photoshop work... and for this need Stability, the last thing i need is a blue screen after 6 hours of rendering... I heard AMD has problems with memory/stability and i got a deal on a Mobo/Ram combo so i got this.... It delivers what i need in Both aspects mentioned.",Stability first and foremost...,i7 14th Gen,i7
United States,5,"This CPU is extremely good. Base speed is 3.40 GHz overclocking speed is 5.6 GHz. L1 cache is 1.8 MB, L2 cache is 28 MB and L3 is 33 MB. Handles most CPU intensive games really well.",20 Cores with 28 Logical processors,i7 14th Gen,i7
United States,5,"4 more efficiency cores than 13700K for about the same price! If you worried about the heat and power draw, go into the BIOS and set the CPU max power draw to 253W which is the max power draw from Intel's website. By setting CPU max power draw to 253W in BIOS, my temperature went from 93c down to 82c in Cinebench 2024 stress test. Actually only draws 60-70w when I game. Most of the time you will not use all the CPU cores so don't worry about power draw.",Great CPU for the price,i7 14th Gen,i7
United States,5,"I have used this for my build and 3 others, didn't realize what the F is for...Get the K, it's not much more and worth the extra. That being said, this beast will do everything you want it to do and more.",GET THE 14700K,i7 14th Gen,i7
